{
  "$schema": "https://json-schema.org/draft/2020-12/schema",
  "$id": "https://raw.githubusercontent.com/openwallet-foundation-labs/eudiplo/refs/heads/main/schemas/CertImportDto.schema.json",
  "title": "CertImportDto",
  "type": "object",
  "properties": {
    "keyId": {
      "type": "string",
      "description": "The key ID this certificate is associated with",
      "example": "039af178-3ca0-48f4-a2e4-7b1209f30376"
    },
    "id": {
      "type": "string"
    },
    "crt": {
      "description": "Certificate chain in PEM format (leaf first, then intermediates/CA).\nIf not provided, a self-signed certificate will be generated.",
      "type": "array",
      "items": {
        "type": "string"
      }
    },
    "subjectName": {
      "type": "string",
      "description": "Subject name (CN) for self-signed certificate generation.\nIf not provided, the tenant name will be used."
    },
    "description": {
      "type": "string",
      "description": "Description of the key."
    }
  },
  "required": [
    "keyId"
  ]
}