{
  "id": "9687a941-3f89-476b-b383-aa5fea1baa8e",
  "keyId": "dbb65456-c358-46c1-bb5b-c777ef72c1d3",
  "description": "imported cert",
  "crt": [
    "-----BEGIN CERTIFICATE-----\nMIICbjCCAhWgAwIBAgIUOxD7JFkKYgFPk8J3ZmSsEC2BHl4wCgYIKoZIzj0EAwIw\nKDELMAkGA1UEBhMCREUxGTAXBgNVBAMMEEdlcm1hbiBSZWdpc3RyYXIwHhcNMjYw\nMjA4MDk1MjM5WhcNMjcwMjA4MDk1MjM5WjBtMQswCQYDVQQGEwJERTEfMB0GA1UE\nCgwWRVVESSBXYWxsZXQgUGxheWdyb3VuZDEcMBoGA1UEYQwTREUuNDg3MzUyQzBG\nNjE3MUNEMzEfMB0GA1UEAwwWRVVESSBXYWxsZXQgUGxheWdyb3VuZDBZMBMGByqG\nSM49AgEGCCqGSM49AwEHA0IABBx5JG1ICkpJKl5i/LrZfky1iIPAmEEuFjyfI/5z\nuOGM1NJY0LT3mEuucLQCZJWNrA7fVW8ypR4Zf5cuu85NjSyjgdcwgdQwDAYDVR0T\nAQH/BAIwADAdBgNVHQ4EFgQUb0F+A3zaJY/8REbKujJ59CydS2QwHwYDVR0jBBgw\nFoAUqcKj2i9trFTuzrlO6CzJLACDgDMwDgYDVR0PAQH/BAQDAgeAMBIGA1UdJQQL\nMAkGByiBjF0FAQYwFAYDVR0RBA0wC4IJbG9jYWxob3N0MEoGA1UdHwRDMEEwP6A9\noDuGOWh0dHBzOi8vc2FuZGJveC5ldWRpLXdhbGxldC5vcmcvYXBpL3N0YXR1cy1t\nYW5hZ2VtZW50L2NybDAKBggqhkjOPQQDAgNHADBEAiBzcDqslCQuHwOjmn2VGJJT\n0msgk1bUmKY0xh1euq8RzAIgImDbGaiwhsHOASojKdpsm/Xm3NAfUAU4L9tCHHwy\nF/0=\n-----END CERTIFICATE-----",
    "-----BEGIN CERTIFICATE-----\nMIICLzCCAdSgAwIBAgIUHyRjE466YA7tc888k03Ou2QodF4wCgYIKoZIzj0EAwIw\nKDELMAkGA1UEBhMCREUxGTAXBgNVBAMMEEdlcm1hbiBSZWdpc3RyYXIwHhcNMjYw\nMTE2MTExNTU0WhcNMjgwMTE2MTExNTU0WjAoMQswCQYDVQQGEwJERTEZMBcGA1UE\nAwwQR2VybWFuIFJlZ2lzdHJhcjBZMBMGByqGSM49AgEGCCqGSM49AwEHA0IABMef\nY2X4ixfRkWEvp9grF2i21z6PKZsr8zzBaJ/+GnotCeH2cJ6GtLhxXhHfJjrETsMN\nIGhVaJoHoHcZTBHJrfyjgdswgdgwHQYDVR0OBBYEFKnCo9ovbaxU7s65TugsySwA\ng4AzMB8GA1UdIwQYMBaAFKnCo9ovbaxU7s65TugsySwAg4AzMBIGA1UdEwEB/wQI\nMAYBAf8CAQAwDgYDVR0PAQH/BAQDAgEGMCoGA1UdEgQjMCGGH2h0dHBzOi8vc2Fu\nZGJveC5ldWRpLXdhbGxldC5vcmcwRgYDVR0fBD8wPTA7oDmgN4Y1aHR0cHM6Ly9z\nYW5kYm94LmV1ZGktd2FsbGV0Lm9yZy9zdGF0dXMtbWFuYWdlbWVudC9jcmwwCgYI\nKoZIzj0EAwIDSQAwRgIhAIY7ERpRrDRl0lr5H5uxjJ83JR4qua2sfPKxX+pl4Qw+\nAiEA2qL6LXVORA2r2VZjSEknfciwIG7laA12kjnyGAD3V/A=\n-----END CERTIFICATE-----"
  ]
}